"id","name","overview","website_url","total_funded_amount","established_at","last_funded_at","funded_from_vc","is_samurai_member","source_id","stage_id","country_id"
"","株式会社ネストエッグ","つみたて貯金・おつり貯金、及び毎日12時に届くクエストをクリアすると21時に貯金が実行される自動貯金サービス「finbee (フィンビー)」の開発、提供","http://nestegg.co.jp/","499,796","2016/04/01","2019/10/30","TRUE","FALSE","1","3","1"
"","GVA TECH株式会社","スタートアップ、フリーランスのための契約リスク判定サービス「AI-CON（アイコン）」を提供。
法人登記支援サービス「AI-CON登記」を提供。
エンタープライズ向けに、それぞれの会社の法務基準に合った契約書レビューを提示する「AI-CON Pro」の開発・提供","http://gvatech.co.jp/","358,134","2017/01/04","2019/08/22","TRUE","FALSE","1","2","1"
"","株式会社アールティ","研究用教材、ホビー製品、関連部品、クラウドロボティクス関連製品など、様々な分野でサービスロボットを開発提供
人と⼀緒に弁当を盛り付ける、弁当工場向け協働ロボット「Foodly（フードリー）」の開発
Google社のAndroid OSで動作するロボット「RIC android(リックアンドロイド)」開発","http://www.rt-net.jp/","558,100","2005/09/12","2019/07/05","TRUE","FALSE","1","3","1"